{
  "$schema": "meridian-request-register/1",
  "source": {
    "repository": "mliad313sn/RT365",
    "branch": "claude/project-owner-agent-setup-hi3xqu",
    "commit": "670bfbd",
    "documents": [
      "docs/ADRs/ADR-017.md",
      "docs/IMPROVEMENT_REGISTER.md",
      "docs/MISSING_ACTIONS.md",
      "docs/PMO.md",
      "docs/PMO_MERIDIAN_ASSESSMENT.md",
      "docs/PMO_MERIDIAN_ASSESSMENT.md §8 (V-1..V-12)",
      "docs/RAID_LOG.md",
      "docs/REPORTS/PMO_MERIDIAN_CONSOLIDATED_REPORT.md",
      "docs/REPORTS/PMO_MERIDIAN_REPORT_EVIDENCE.md (E-1..E-9, G-1..G-9)",
      "docs/REPORTS/PMO_MERIDIAN_REPORT_VALUE.md (V-1..V-15)",
      "docs/REPORTS/meridian_requests_v3.json",
      "scripts/meridian_sync.py"
    ],
    "reviewedAt": "2026-09-23",
    "branchPinned": "claude/meridian-rt365-feedback-d6vo3i",
    "vocabulary": {
      "request": [
        "M-\\d{2}",
        "I-\\d{1,2}",
        "O-\\d{2,3}",
        "H-\\d{2}"
      ],
      "context": [
        "D-\\d{3}",
        "ADR-\\d{3}",
        "PR-\\d{2}"
      ],
      "note": "RT365 ledger ids: M/I = assessment findings and improvements, O = RAID rows, H = human acts; D/ADR/PR are decisions, architecture records and pull requests — read for context, never counted as a missing request."
    }
  },
  "productOwner": {
    "charter": "docs/33-retour-terrain-rt365.md#1",
    "command": ".claude/commands/product-owner.md",
    "lastRun": "2026-09-08"
  },
  "requests": [
    {
      "id": "REQ-01",
      "origin": [
        "I-1",
        "M-01",
        "M-02",
        "M-03",
        "O-73"
      ],
      "title": "The first hour: .env, default data directory, dev builds, no silent in-memory book",
      "status": "done",
      "version": "5.10.0",
      "decidedOn": "2026-09-08",
      "delivered": [
        "server/src/env.js",
        "scripts/dev.mjs",
        "server/src/index.js#503-page",
        ".env.example"
      ],
      "measure": "server/test/firsthour.test.js",
      "remaining": null,
      "answerToSource": "O-73 can be closed; delete the workaround in docs/PMO.md §2.",
      "issue": 1,
      "accepted": false,
      "released": false,
      "history": [
        {
          "at": "2026-09-08",
          "registerVersion": 1,
          "status": "done"
        }
      ]
    },
    {
      "id": "REQ-02",
      "origin": [
        "I-2",
        "M-05",
        "O-74",
        "INT-13"
      ],
      "title": "Write API v1 by external id with Idempotency-Key",
      "status": "done",
      "version": "5.10.0",
      "decidedOn": "2026-09-08",
      "delivered": [
        "server/migrations/035_write_api.sql",
        "server/src/v1write.js",
        "server/src/routes/v1.js",
        "docs/openapi.v1.json",
        "adopt on every collection",
        "PUT /api/v1/criteria/:externalId",
        "cr by Meridian id",
        "true last-writer-wins without version",
        "Idempotency-Key reserved before the handler, canonical body"
      ],
      "measure": "server/test/writeapi.test.js",
      "api": {
        "scopes": [
          "write:portfolio",
          "write:meetings"
        ],
        "routes": [
          "PUT /api/v1/projects/:externalId",
          "PUT /api/v1/milestones/:externalId",
          "PUT /api/v1/raid/:externalId",
          "PUT /api/v1/activities/:externalId",
          "PUT /api/v1/workitems/:externalId",
          "PUT /api/v1/decisions/:externalId",
          "PUT /api/v1/actions/:externalId",
          "PUT /api/v1/criteria/:externalId"
        ],
        "header": "Idempotency-Key"
      },
      "remaining": "structure (sites, programmes, people) stays on the session API and CSV import — D-33.4",
      "answerToSource": "O-74 can be closed; meridian_sync.py can move to PUT /api/v1/* with its own ids and unpin the commit.",
      "issue": 2,
      "accepted": null,
      "released": false,
      "history": [
        {
          "at": "2026-09-08",
          "registerVersion": 1,
          "status": "done"
        },
        {
          "at": "2026-09-08",
          "registerVersion": 2,
          "status": "done",
          "note": "second round after the counsellors: adopt, criteria route, cr, version, idempotency reservation"
        }
      ]
    },
    {
      "id": "REQ-03",
      "origin": [
        "I-3",
        "M-04",
        "O-75"
      ],
      "title": "Gate ladder per programme",
      "status": "done",
      "version": "5.10.0",
      "decidedOn": "2026-09-08",
      "delivered": [
        "server/migrations/036_gate_ladder.sql",
        "shared/engine.js#normaliseGateModel",
        "server/src/wbs.js",
        "web/src/views/administration.js#programmeDialog"
      ],
      "measure": "server/test/gates.test.js",
      "remaining": "phases stay six (D-33.9); gate passage per project (D-33.10)",
      "answerToSource": "O-75 can be closed; declare A–F on programme RBT, then create the epics.",
      "issue": 3,
      "accepted": false,
      "released": false,
      "history": [
        {
          "at": "2026-09-08",
          "registerVersion": 1,
          "status": "done"
        }
      ]
    },
    {
      "id": "REQ-04",
      "origin": [
        "I-4",
        "M-06"
      ],
      "title": "Gate criteria found met by a named, independent reviewer",
      "status": "done",
      "version": "5.10.0",
      "decidedOn": "2026-09-08",
      "delivered": [
        "server/migrations/037_gate_criteria.sql",
        "server/src/routes/portfolio.js#criteria",
        "shared/engine.js#gateStatus",
        "PUT /api/v1/criteria/:externalId"
      ],
      "measure": "server/test/gates.test.js",
      "remaining": null,
      "issue": 4,
      "accepted": null,
      "released": false,
      "history": [
        {
          "at": "2026-09-08",
          "registerVersion": 1,
          "status": "done"
        }
      ]
    },
    {
      "id": "REQ-05",
      "origin": [
        "I-5",
        "M-07"
      ],
      "title": "Progress and cost from source systems",
      "status": "partial",
      "version": "5.10.0",
      "decidedOn": "2026-09-08",
      "delivered": [
        "PUT /api/v1/activities/:externalId (pct, source, measuredAt)",
        "activity.progress_source / progress_at"
      ],
      "measure": "server/test/writeapi.test.js",
      "remaining": "connectors INT-10/11/12 and cost lines by external id — written from the source side (D-33.5)",
      "issue": 5,
      "accepted": null,
      "released": false,
      "history": [
        {
          "at": "2026-09-08",
          "registerVersion": 1,
          "status": "partial"
        }
      ]
    },
    {
      "id": "REQ-06",
      "origin": [
        "I-6",
        "M-08",
        "O-76",
        "H-28",
        "G-01",
        "SaaS-03",
        "SaaS-04",
        "SaaS-05"
      ],
      "title": "Operate-for-real kit: backup, restore drill, instance identity, production refusals, runbook",
      "status": "done",
      "version": "5.10.0",
      "decidedOn": "2026-09-08",
      "delivered": [
        "server/src/backup.js",
        "scripts/backup.mjs",
        "scripts/restore-drill.mjs",
        "GET /api/health#instance,backup",
        "docs/34-exploitation.md"
      ],
      "measure": "server/test/backup.test.js",
      "remaining": "the acts: PostgreSQL, scheduled backup, monthly drill, signed policy — RT365's operator (H-28)",
      "issue": 6,
      "accepted": false,
      "released": false,
      "history": [
        {
          "at": "2026-09-08",
          "registerVersion": 1,
          "status": "done"
        },
        {
          "at": "2026-09-08",
          "registerVersion": 2,
          "status": "done",
          "note": "runbook corrected: createdb right, first administrator before start, tenant .env in cron, restore-to-live and rollback, PGlite refuses while the server runs"
        }
      ]
    },
    {
      "id": "REQ-07",
      "origin": [
        "I-7"
      ],
      "title": "Decisions as first-class records outside meetings",
      "status": "done",
      "version": "5.10.0",
      "decidedOn": "2026-09-08",
      "delivered": [
        "server/migrations/034_decision_register.sql",
        "POST /api/decisions",
        "GET /api/decisions/log",
        "server/migrations/039_decision_record.sql (council, evidence_uri, provenance, status, ratified_by)"
      ],
      "measure": "server/test/decisions.test.js",
      "remaining": null,
      "issue": 7,
      "accepted": false,
      "released": false,
      "history": [
        {
          "at": "2026-09-08",
          "registerVersion": 1,
          "status": "done"
        },
        {
          "at": "2026-09-08",
          "registerVersion": 2,
          "status": "done",
          "note": "council, evidence link, provenance, Proposed/Ratified added (D-33.11)"
        }
      ]
    },
    {
      "id": "REQ-08",
      "origin": [
        "I-8"
      ],
      "title": "RAID linked to gates and change requests; review dates on the agenda",
      "status": "done",
      "version": "5.10.0",
      "decidedOn": "2026-09-08",
      "delivered": [
        "raid_item.gate",
        "raid_item.cr_id",
        "shared/meetings.js#reviews"
      ],
      "measure": "server/test/decisions.test.js",
      "remaining": null,
      "issue": 8,
      "accepted": false,
      "released": false,
      "history": [
        {
          "at": "2026-09-08",
          "registerVersion": 1,
          "status": "done"
        }
      ]
    },
    {
      "id": "REQ-09",
      "origin": [
        "I-9",
        "M-09"
      ],
      "title": "Release discipline: one version everywhere, F10 gate, release workflow",
      "status": "done",
      "version": "5.10.0",
      "decidedOn": "2026-09-08",
      "delivered": [
        "scripts/audit/release-audit.mjs",
        ".github/workflows/release.yml",
        "server/src/env.js#packageVersion"
      ],
      "measure": "npm run audit (F10)",
      "remaining": "tags are pushed by a maintainer",